{"accessibilityChecks":[{"captureID":null,"id":"confirmed-owner-headline","request":{"appearance":"light","contrast":"standard","interaction":"none","state":"active-manual","surface":"main","textSize":"standard","transparency":"standard","window":"1180x820"},"status":"pending"},{"captureID":null,"id":"correct-per-fan-target","request":{"appearance":"light","contrast":"standard","interaction":"none","state":"divergent-per-fan-curve-draft","surface":"main","textSize":"standard","transparency":"standard","window":"1180x820"},"status":"pending"},{"captureID":null,"id":"six-adjustable-point-controls","request":{"appearance":"light","contrast":"standard","interaction":"none","state":"divergent-per-fan-curve-draft","surface":"main","textSize":"standard","transparency":"standard","window":"1180x820"},"status":"pending"},{"captureID":null,"id":"sensor-selected-trait-value","request":{"appearance":"light","contrast":"standard","interaction":"none","state":"selected-vs-highest-temperature","surface":"main","textSize":"standard","transparency":"standard","window":"1180x820"},"status":"pending"},{"captureID":null,"id":"explicit-temperature-role","request":{"appearance":"light","contrast":"standard","interaction":"none","state":"selected-vs-highest-temperature","surface":"main","textSize":"standard","transparency":"standard","window":"1180x820"},"status":"pending"},{"captureID":null,"id":"notification-actions","request":{"appearance":"light","contrast":"standard","interaction":"none","state":"notification-denied","surface":"settings-notifications","textSize":"standard","transparency":"standard","window":"native"},"status":"pending"},{"captureID":null,"id":"settings-logical-traversal","request":{"appearance":"light","contrast":"standard","interaction":"none","state":"healthy-auto","surface":"settings-general","textSize":"standard","transparency":"standard","window":"native"},"status":"pending"},{"captureID":null,"id":"no-duplicate-chart-elements","request":{"appearance":"light","contrast":"standard","interaction":"none","state":"divergent-per-fan-curve-draft","surface":"main","textSize":"standard","transparency":"standard","window":"1180x820"},"status":"pending"},{"captureID":null,"id":"compact-main-scroll-reachable","request":{"appearance":"light","contrast":"standard","interaction":"structural-scroll","state":"healthy-auto","surface":"main","textSize":"accessibility","transparency":"standard","window":"780x480"},"status":"pending"},{"captureID":null,"id":"settings-general-scroll-reachable","request":{"appearance":"light","contrast":"standard","interaction":"structural-scroll","state":"healthy-auto","surface":"settings-general","textSize":"accessibility","transparency":"standard","window":"native"},"status":"pending"},{"captureID":null,"id":"settings-menu-bar-scroll-reachable","request":{"appearance":"light","contrast":"standard","interaction":"structural-scroll","state":"healthy-auto","surface":"settings-menu-bar","textSize":"accessibility","transparency":"standard","window":"native"},"status":"pending"},{"captureID":null,"id":"settings-notifications-scroll-reachable","request":{"appearance":"light","contrast":"standard","interaction":"structural-scroll","state":"notification-denied","surface":"settings-notifications","textSize":"accessibility","transparency":"standard","window":"native"},"status":"pending"},{"captureID":null,"id":"settings-agent-workflows-scroll-reachable","request":{"appearance":"light","contrast":"standard","interaction":"structural-scroll","state":"healthy-auto","surface":"settings-agent-workflows","textSize":"accessibility","transparency":"standard","window":"native"},"status":"pending"}],"captureLedger":{},"evidenceKind":"hardware-free-native-container-debug-fixture","fixtureReports":[{"captureID":null,"request":{"appearance":"light","contrast":"standard","interaction":"none","state":"healthy-auto","surface":"main","textSize":"standard","transparency":"standard","window":"1180x820"},"state":"healthy-auto","status":"pending"},{"captureID":null,"request":{"appearance":"light","contrast":"standard","interaction":"none","state":"divergent-per-fan-curve-draft","surface":"main","textSize":"standard","transparency":"standard","window":"1180x820"},"state":"divergent-per-fan-curve-draft","status":"pending"},{"captureID":null,"request":{"appearance":"light","contrast":"standard","interaction":"none","state":"active-manual","surface":"main","textSize":"standard","transparency":"standard","window":"1180x820"},"state":"active-manual","status":"pending"},{"captureID":null,"request":{"appearance":"light","contrast":"standard","interaction":"none","state":"recovery-mixed-ownership","surface":"main","textSize":"standard","transparency":"standard","window":"1180x820"},"state":"recovery-mixed-ownership","status":"pending"},{"captureID":null,"request":{"appearance":"light","contrast":"standard","interaction":"none","state":"helper-blocked","surface":"main","textSize":"standard","transparency":"standard","window":"1180x820"},"state":"helper-blocked","status":"pending"},{"captureID":null,"request":{"appearance":"light","contrast":"standard","interaction":"none","state":"notification-denied","surface":"main","textSize":"standard","transparency":"standard","window":"1180x820"},"state":"notification-denied","status":"pending"},{"captureID":null,"request":{"appearance":"light","contrast":"standard","interaction":"none","state":"edited-profile","surface":"main","textSize":"standard","transparency":"standard","window":"1180x820"},"state":"edited-profile","status":"pending"},{"captureID":null,"request":{"appearance":"light","contrast":"standard","interaction":"none","state":"selected-vs-highest-temperature","surface":"main","textSize":"standard","transparency":"standard","window":"1180x820"},"state":"selected-vs-highest-temperature","status":"pending"},{"captureID":null,"request":{"appearance":"light","contrast":"standard","interaction":"none","state":"raw-spike-telemetry","surface":"main","textSize":"standard","transparency":"standard","window":"1180x820"},"state":"raw-spike-telemetry","status":"pending"}],"fixtureStates":["healthy-auto","divergent-per-fan-curve-draft","active-manual","recovery-mixed-ownership","helper-blocked","notification-denied","edited-profile","selected-vs-highest-temperature","raw-spike-telemetry"],"humanAttestations":{"visual":{"artifact":"attestations/visual-attestation.json","sha256":null,"status":"pending"},"voiceOver":{"artifact":"attestations/voiceover-attestation.json","sha256":null,"status":"pending"}},"nonClaims":["This committed file is a request-only template; completed captures belong in the ignored local manifest.","Pending entries are requirements, not completed visual, accessibility, or human-attestation evidence.","Fixture evidence does not validate real fan writes, helper installation, cooling leases, or Auto restoration.","Accessibility hierarchy evidence does not prove VoiceOver speech, traversal, rotor behavior, or announcements."],"releaseExclusion":{"binary":".build/ui-review-products/release/Vifty","buildProvenance":null,"forbiddenMarkers":["--ui-review-fixture","ViftyReviewFixture"],"sha256":null,"status":"pending"},"safetyContract":{"attemptedExternalMutations":0,"attemptedHardwareCommands":0,"captureLinkRequired":true,"finalReportRequired":true,"modelStartSkipped":true,"observedEnvironmentRequired":true,"observedNSWindowRequired":true,"realControlPathConstructions":0},"schemaVersion":3,"status":"pending","visualCells":[{"captureID":null,"id":"main-780x480-light","request":{"appearance":"light","contrast":"standard","interaction":"none","state":"healthy-auto","surface":"main","textSize":"standard","transparency":"standard","window":"780x480"},"status":"pending"},{"captureID":null,"id":"main-780x480-dark","request":{"appearance":"dark","contrast":"standard","interaction":"none","state":"healthy-auto","surface":"main","textSize":"standard","transparency":"standard","window":"780x480"},"status":"pending"},{"captureID":null,"id":"main-1180x820-light","request":{"appearance":"light","contrast":"standard","interaction":"none","state":"healthy-auto","surface":"main","textSize":"standard","transparency":"standard","window":"1180x820"},"status":"pending"},{"captureID":null,"id":"main-1180x820-dark","request":{"appearance":"dark","contrast":"standard","interaction":"none","state":"healthy-auto","surface":"main","textSize":"standard","transparency":"standard","window":"1180x820"},"status":"pending"},{"captureID":null,"id":"main-1280x720-light","request":{"appearance":"light","contrast":"standard","interaction":"none","state":"healthy-auto","surface":"main","textSize":"standard","transparency":"standard","window":"1280x720"},"status":"pending"},{"captureID":null,"id":"main-1280x720-dark","request":{"appearance":"dark","contrast":"standard","interaction":"none","state":"healthy-auto","surface":"main","textSize":"standard","transparency":"standard","window":"1280x720"},"status":"pending"},{"captureID":null,"id":"main-1500x900-light","request":{"appearance":"light","contrast":"standard","interaction":"none","state":"healthy-auto","surface":"main","textSize":"standard","transparency":"standard","window":"1500x900"},"status":"pending"},{"captureID":null,"id":"main-1500x900-dark","request":{"appearance":"dark","contrast":"standard","interaction":"none","state":"healthy-auto","surface":"main","textSize":"standard","transparency":"standard","window":"1500x900"},"status":"pending"},{"captureID":null,"id":"state-divergent-per-fan-curve-draft","request":{"appearance":"light","contrast":"standard","interaction":"none","state":"divergent-per-fan-curve-draft","surface":"main","textSize":"standard","transparency":"standard","window":"1180x820"},"status":"pending"},{"captureID":null,"id":"state-active-manual","request":{"appearance":"light","contrast":"standard","interaction":"none","state":"active-manual","surface":"main","textSize":"standard","transparency":"standard","window":"1180x820"},"status":"pendi